slug,category,nameSingularTitleCase,namePluralTitleCase,nameSingularSentenceCase,namePluralSentenceCase,description
watercress,vegetable,Watercress,Watercress,watercress,watercress,A peppery aquatic green used in salads and sandwiches.
winter-squash,vegetable,Winter Squash,Winter Squash,winter squash,winter squash,A hard-skinned squash harvested mature and stored for months.
yam,vegetable,Yam,Yams,yam,yams,A starchy tropical tuber with dry earthy flesh.
zucchini,vegetable,Zucchini,Zucchini,zucchini,zucchini,A prolific summer squash best harvested young and tender.
amaranth,vegetable,Amaranth,Amaranth,amaranth,amaranth,A nutritious grain and leafy green used in many traditional cuisines.
bitter-melon,vegetable,Bitter Melon,Bitter Melons,bitter melon,bitter melons,A bumpy tropical gourd prized for its distinctive bitter flavor.
cassava,vegetable,Cassava,Cassava,cassava,cassava,A starchy tropical root used for tapioca and flour.
chayote,vegetable,Chayote,Chayotes,chayote,chayotes,A mild pear-shaped gourd used fresh or cooked in many Latin cuisines.
nopal,vegetable,Nopal,Nopales,nopal,nopales,A flat cactus pad used as a vegetable in Mexican cooking.
pea,vegetable,Pea,Peas,pea,peas,A sweet shelling legume harvested fresh or dried.
purslane,vegetable,Purslane,Purslane,purslane,purslane,A succulent edible weed rich in omega-3s used fresh in salads.
taro,vegetable,Taro,Taro,taro,taro,A starchy tropical root cooked like potato in many Asian cuisines.
